{
  "id": "text-equals",
  "suite": "filter-text",
  "description": "equals on the whole folded text.",
  "input": {
    "locale": "fr-FR",
    "columns": [
      {
        "id": "n"
      }
    ],
    "rows": [
      {
        "id": "1",
        "n": "Éric"
      },
      {
        "id": "2",
        "n": "eric"
      },
      {
        "id": "3",
        "n": "Zoé"
      },
      {
        "id": "4",
        "n": ""
      },
      {
        "id": "5",
        "n": null
      },
      {
        "id": "6",
        "n": "Eric Dupont"
      }
    ],
    "filter": {
      "n": {
        "type": "text",
        "op": "equals",
        "value": "eric"
      }
    }
  },
  "expected": {
    "ids": [
      "1",
      "2"
    ]
  }
}
