{
  "id": "swap-series-copies",
  "suite": "fill-plan",
  "description": "Ctrl at the drop on 1, 2: the pattern copied.",
  "input": {
    "shown": [
      "r1",
      "r2",
      "r3",
      "r4",
      "r5",
      "r6"
    ],
    "columns": [
      {
        "id": "n",
        "type": "number"
      },
      {
        "id": "d",
        "type": "day"
      },
      {
        "id": "t"
      },
      {
        "id": "e",
        "type": "enum",
        "enumOptions": [
          {
            "value": "in",
            "label": "En stock"
          },
          {
            "value": "out",
            "label": "Rupture"
          }
        ]
      },
      {
        "id": "b",
        "type": "boolean"
      },
      {
        "id": "i",
        "type": "instant"
      }
    ],
    "rows": {
      "r1": {
        "n": 1
      },
      "r2": {
        "n": 2
      }
    },
    "src": {
      "top": 0,
      "bottom": 1,
      "start": 0,
      "end": 0
    },
    "to": {
      "row": 4,
      "col": 0
    },
    "swap": true
  },
  "expected": {
    "target": {
      "box": {
        "top": 2,
        "bottom": 4,
        "start": 0,
        "end": 0
      },
      "way": "down"
    },
    "cells": [
      [
        "r3",
        "n",
        {
          "value": 1
        }
      ],
      [
        "r4",
        "n",
        {
          "value": 2
        }
      ],
      [
        "r5",
        "n",
        {
          "value": 1
        }
      ]
    ]
  }
}
