{
  "id": "open-after-master",
  "suite": "detail",
  "description": "An open master shows its detail right after it, 240 px by default (owner Q4); closing one removes it.",
  "input": {
    "rows": [
      {
        "id": "a",
        "n": 3,
        "t": "ward"
      },
      {
        "id": "b",
        "n": 1,
        "t": "bed"
      },
      {
        "id": "c",
        "n": 2,
        "t": "ward"
      },
      {
        "id": "d",
        "n": 5,
        "t": "bed"
      },
      {
        "id": "e",
        "n": 4,
        "t": "ward"
      }
    ],
    "steps": [
      {
        "expand": [
          "b",
          "d"
        ]
      },
      {
        "expand": [
          "b"
        ],
        "expanded": false
      }
    ]
  },
  "expected": {
    "shown": [
      "a",
      "b",
      "c",
      "d",
      "> d",
      "e"
    ],
    "expansion": [
      "d"
    ],
    "counts": {
      "total": 5,
      "filtered": 5,
      "displayed": 6
    },
    "heights": [
      240
    ],
    "page": null,
    "problems": []
  }
}
