{
  "id": "days-step-28",
  "suite": "fill-plan",
  "description": "2026-01-31, 2026-02-28: a step of 28 days goes on.",
  "input": {
    "shown": [
      "r1",
      "r2",
      "r3",
      "r4",
      "r5",
      "r6"
    ],
    "columns": [
      {
        "id": "n",
        "type": "number"
      },
      {
        "id": "d",
        "type": "day"
      },
      {
        "id": "t"
      },
      {
        "id": "e",
        "type": "enum",
        "enumOptions": [
          {
            "value": "in",
            "label": "En stock"
          },
          {
            "value": "out",
            "label": "Rupture"
          }
        ]
      },
      {
        "id": "b",
        "type": "boolean"
      },
      {
        "id": "i",
        "type": "instant"
      }
    ],
    "rows": {
      "r1": {
        "d": "2026-01-31"
      },
      "r2": {
        "d": "2026-02-28"
      }
    },
    "src": {
      "top": 0,
      "bottom": 1,
      "start": 1,
      "end": 1
    },
    "to": {
      "row": 3,
      "col": 1
    }
  },
  "expected": {
    "target": {
      "box": {
        "top": 2,
        "bottom": 3,
        "start": 1,
        "end": 1
      },
      "way": "down"
    },
    "cells": [
      [
        "r3",
        "d",
        {
          "value": "2026-03-28"
        }
      ],
      [
        "r4",
        "d",
        {
          "value": "2026-04-25"
        }
      ]
    ]
  }
}
