{
  "id": "escape-popup",
  "suite": "keyboard-intent",
  "description": "A popup owns Escape (it closes itself).",
  "input": {
    "key": "Escape",
    "dir": "ltr",
    "owner": "popup",
    "mac": false,
    "ctrl": false,
    "meta": false,
    "shift": false,
    "alt": false
  },
  "expected": {
    "intent": null
  }
}
