{
  "id": "min-max-day",
  "suite": "edit-input",
  "description": "Day limits compared as days.",
  "input": {
    "locale": "fr-FR",
    "columns": [
      {
        "id": "d",
        "editable": true,
        "type": "day",
        "edit": {
          "min": "2026-01-01",
          "max": "2026-12-31"
        }
      }
    ],
    "rows": [
      {
        "id": "a",
        "v": 3,
        "n": "q",
        "s": "z",
        "d": "2026-05-01",
        "ok": true
      },
      {
        "id": "b",
        "v": 1,
        "n": "y",
        "s": "a",
        "d": null,
        "ok": false
      }
    ],
    "steps": [
      {
        "check": [
          "a",
          "d",
          {
            "text": "31/12/2025"
          }
        ]
      },
      {
        "check": [
          "a",
          "d",
          {
            "text": "01/01/2027"
          }
        ]
      },
      {
        "check": [
          "a",
          "d",
          {
            "text": "15/06/2026"
          }
        ]
      },
      {
        "check": [
          "a",
          "d",
          {
            "text": "01/01/2026"
          }
        ]
      }
    ]
  },
  "expected": {
    "results": [
      {
        "code": "min"
      },
      {
        "code": "max"
      },
      {
        "value": "2026-06-15"
      },
      {
        "value": "2026-01-01"
      }
    ],
    "problems": []
  }
}
